パワーサプライ分野は、メガソーラー向けパワーコンディショナの需要減少及び為替影響により、売上高は前連結会計年度を下回りましたが、原価低減等の推進により、営業損益は前連結会計年度を上回りました	0
当連結会計年度の営業収益は5,303百万円（前年同期比3.2％減）、営業利益は249百万円（同68.3％増）、経常利益は228百万円（同63.5％増）、親会社株主に帰属する当期純利益は有価証券売却による特別利益の計上等により486百万円（同270.3％増）となりました	1
純資産は、利益の積み上げにより株主資本が増加した一方、その他有価証券評価差額金の減少等により、前連結会計年度末比１億円増加の2,832億円となりました	1
当連結会計年度における日本経済は、企業収益や雇用・所得環境の改善を背景に緩やかな回復基調となりましたが、米国の政策動向や海外情勢など景気の先行きは不透明な状況が続いております	1
また、登録受取手数料等の手数料収入は減少したものの、整備業務を行うサービス売上は増加したことから、売上高は57億95百万円（前期比3.6％増）となりました	1
当連結会計年度における当社グループを取り巻く経済環境は、国内では輸出や生産は持ち直しの動きが続いており、企業収益も改善の動きが見られるなど、景気は緩やかな回復基調で推移した	1
しかしながら、沿線の就学人口の減少や８月後半から９月にかけての天候不順の影響による旅客の減少を補いきれず、旅客人員及び旅客収入は前年同期に比べ減少いたしました	0
当連結会計年度中の世界経済を見ますと、米国は比較的堅調に推移しましたが、年度当初は中国経済の減速が明らかとなり、商品市況の低迷で資源国・新興国の成長も鈍化、それに中東情勢や英国のEU離脱決定が加わり、不透明感が強まりました	0
住宅事業では、建築請負部門で前連結会計年度の受注実績の影響を受け、戸建住宅「へーベルハウス™」や集合住宅「ヘーベルメゾン™」の引渡棟数が減少し、広告宣伝費等の販管費が増加しました	0
このような状況のもと、当連結会計年度の業績につきましては、機器製品及びアジア地域での船舶用システム製品の売上の減少、為替の円高推移の影響などもあり、売上高は328億円73百万円と前年同期比16.6％の減少となりました	0
ただ１-３月期に入ると消費関連指標に若干の改善がみられるようになっています	1
株式会社吉利における粗利率の低下と販管費が増加し、この結果、売上高22億43百万円（前年同期比3.9％増）、営業利益は６百万円（前年同期比87.6％減）となりました	0
これにより、売上高は前連結会計年度に比べて減少しました	0
その結果、当社グループの業績は、売上高は、販売数量は増加したものの、主に製品価格改定の影響や円高による海外事業の外貨円換算額の減少により下回りました	0
その結果、当事業全体の売上高は9億1千9百万円（前年同期比20.6％減）、営業利益は1億1千6百万円（前年同期比6.0％減）となりました	0
日本において繰延税金資産の取崩しや固定資産の減損損失計上等もあり、親会社株主に帰属する当期純損失は2,511百万円（前期は親会社株主に帰属する当期純利益2,699百万円）となりました	0
以上の結果、当期の国際線旅客数は911万人（前期比11.6％増）となり、収入は5,167億円（同0.2％増）となった	1
この結果、経常利益は前期比17億33百万円減少の158億67百万円となり、親会社株主に帰属する当期純利益は、法人税、住民税及び事業税の減少を主因に、前期比12億82百万円増加の108億51百万円となりました	1
売上高は前期比5.3％減の2,395億円余となった	0
これにより、当連結会計年度では当初予想の損失額を大きく上回り、営業損失22億76百万円を計上いたしました（前年同期は、営業利益３億６百万円）	0
この結果、当連結会計年度の当社グループの売上高は、210億円（前連結会計年度比84百万円、0.4％増）となりました	1
利益面につきましては、営業利益１億80百万円（前期比48.1％減）、経常利益１億84百万円（前期比47.7％減）、親会社株主に帰属する当期純利益62百万円（前期比68.3％減）となりました	0
完成工事高につきましては、空洞充填工事の完成工事高が619百万円（前事業年度比5.2％減）と減少しましたが、軽量盛土工事の完成工事高が1,645百万円（前事業年度比13.4％増）と増加し、また受注高は大幅に減少しましたが前事業年度からの繰越工事が多かった管路中詰工事の完成工事高が696百万円（前事業年度比1.0％増）と増加したことから、気泡コンクリート工事全体の完成工事高は2,961百万円（前事業年度比6.0％増）と増加いたしました	1
データセンターなどの第三世代ビジネス（クラウド・ビッグデータなど）は堅調に推移するとともに、大規模なパソコン代替案件などハードウェアビジネスが伸長したことにより、売上高は8,974百万円（前連結会計年度比2,869百万円増、47.0％増）、セグメント利益（営業利益）は371百万円（前連結会計年度比158百万円増、74.4％増）と増収増益となりました	1
また、支払利息の減少等により営業外損益は改善しましたが、経常利益は40億84百万円（同1.1％減）となりました	0
売上高は、工事に関する材料並びに機器の販売事業などが減少したことなどから、前連結会計年度に比べ18億88百万円減少（12.8％減）し、128億55百万円となった	0
その結果、連結受注残高は前連結会計年度末より14億69百万円減少し、179億27百万円となりました	0
この結果、売上高は126億17百万円（同4.8％減）となり、営業利益は７億40百万円（同11.2％減）となりました	0
当事業年度末（平成29年３月31日）の単体ソルベンシー・マージン比率は、金利上昇にともなうその他有価証券評価差額金の減少などにより、2,568.8％（同154.0ポイント低下、前年度末2,722.8％）となりました	0
売上高は、自動車売上台数の増加などにより、為替変動に伴う売上高の減少を吸収し、過去最高となる３兆3,260億円と前連結会計年度に比べ937億円（2.9％）の増収となりました	1
親会社株主に帰属する当期純利益につきましては、トップ建材株式会社の子会社化に伴う負ののれんの発生益１億75百万円や設備投資の補助金１億７百万円が特別利益に計上された一方、繰延税金資産の取り崩しに伴う法人税等調整額の増加97百万円などがあり、前期比４億46百万円増の27億90百万円（同19.1％増）となりました	1
製品区分別売上高につきましては、電子機器用は、自動車向けコンデンサは堅調であったものの、家電機器・インバータ向けなどの売上が減少したことなどにより65,662百万円と前期比5.8％の減収となりました	0
クラウド技術を生かした高付加価値案件の獲得により伸長し、売上高は26億43百万円(前年同期比5.7%増)、セグメント利益は1億42百万円(同8.3%増)になりました	1
以上の結果、当社グループの売上高は72億19百万円（前期比3.6％増）となりました	1
ドラッグストア事業は、積極的に店舗改装を実施し、業態転換なども含め食品等の販売に注力してまいりましたが、天候不順やインバウンド関連商品の販売鈍化などの影響により、既存店売上高は前年同期を若干下回りました	0
以上の結果、当部門の売上高は66億68百万円と前連結会計年度に比べ41億95百万円(169.7%)の増加、営業利益は５億46百万円と前連結会計年度に比べ４億86百万円(812.1%)の増加となりました	1
売上高は３億30百万円（前年同期比32.3％減）と大幅減収となりました	0
しかしながら、その一方で、既収載ジェネリック医薬品の薬価が３つに集約された影響、新規収載ジェネリック医薬品の薬価のさらなる引き下げ、大型品目を中心とした相次ぐＡＧ（オーソライズドジェネリック）の登場等が相まって、当期の収益環境は一段と厳しいものとなりました	0
セグメント利益は、完成工事利益率が向上し、前期比26.8％増の137億円余となった	1
当連結会計年度におけるわが国経済は、政府の各種経済政策による下支えはあるものの本格的な景気浮揚には至っておらず、懸案であった個人消費の回復によるデフレ脱却という課題も充分達成されたとは言い難い状況であります	0
この結果、売上高は36億81百万円（同3.1％増）となり、営業利益は２億51百万円（同64.2％増）となりました	1
りました	0
ポリウレタン材料は、事業構造改善による固定費の減少等により、収益が改善しております	1
音楽やアーティスト関連の市場動向といたしましては、平成28年における音楽ソフト（オーディオレコード及び音楽ビデオ合計）の生産数量は212,293千枚（前年同期比5.1%減）、販売金額では245,657百万円（前年同期比3.5%減）と減少しております	0
輸入はアジア発を中心に電子・電気機器関連品等の荷動きが堅調なものとなり、取扱件数は前期比8.6％増となりました	1
希土類磁石については、電動パワーステアリングおよびハイブリッド自動車向け等の自動車用電装部品の需要が好調に推移し、産業機器および家電関連の需要も前年同期を上回りました	1
ゴルフ業では、謝恩特別デーの開催など積極的に営業展開したものの利用者はほぼ横ばいで、減収となりました	0
当連結会計年度の世界経済を概観しますと、米国と欧州の経済が堅調に推移したことに加え、新興国の成長減速傾向に歯止めがかかり、全体として持ち直し基調となりました	1
その結果、売上高は506億５千３百万円（前年度比1.8％減）となりました	0
経常利益は、営業利益の増加を受け、前連結会計年度比168百万円増の6,939百万円となりました	1
売上総利益の減少に加え、販売費及び一般管理費においては、販売促進強化の目的から見積の為の費用が増加したこと等により前年同期比97百万円増加し、営業利益は前年同期比27.3％減の363百万円、経常利益は前年同期比28.6％減の360百万円、当期純利益は前年同期比21.2％減の251百万円となりました	0
その結果、当連結会計年度において営業外費用は50百万円（前年同期比67.0％減）となりました	0
一方、利益面につきましては、クライアントの多様化する課題や難易度の高い大規模案件等に応えるために必要な専門スキルを持つ人件費及び人材獲得費並びに複雑化するプロジェクトの進行管理費の増加、また業容の拡大に伴うオフィス環境整備費などの先行投資費用が増加した結果、セグメント損失は22百万円(前年同期はセグメント利益２億26百万円)となりました	0
その結果、部門全体の売上高は1,694億円（前期比15.0％減）、営業利益は164億円（前期比19.6％減）となった	0
当セグメントの売上収益は、前年同期比8.5％減の234,725百万円となり、調整後営業利益は前年同期比3,525百万円減の23,503百万円となりました	0
アジア・オセアニア市場においては、マレーシア等で売上を伸ばしました	1
また、砂利、砂等の土木建設資材の取り扱いもやや減少いたしました	0
品目別売上収益については、ニューロロジー領域で、「Fycompa」が42億45百万円(前期比17.3％増)と高い成長を確保する一方、抗てんかん剤「Zonegran」が51億67百万円(同32.3％減)、抗てんかん剤「Zebinix」が35億88百万円(同6.2％減)となりました	0
当連結会計年度におけるわが国経済は、景気は緩やかな回復基調が継続しているものの、個人消費には未だ力強さがなく、さらに英国のＥＵ離脱問題や米国のトランプ新政権発足の影響により海外経済の不確実性が高まるなど、景気の先行きについては依然不透明な状況にあります	0
受注高については、建築工事89,418百万円（前連結会計年度比17.5％増）、土木工事31,380百万円（前連結会計年度比36.3％減）の合計120,799百万円（前連結会計年度比3.6％減）となり、完成工事高は、建築工事75,090百万円（前連結会計年度比9.9％減）、土木工事34,164百万円（前連結会計年度比16.4％増）の合計109,255百万円（前連結会計年度比3.1％減）、営業利益は3,492百万円（前連結会計年度比3.4％減）である	0
その他、11月に国内外で発売した「ニンテンドークラシックミニ  ファミリーコンピュータ（日本版名称）」は各地で好評となりました	1
米国経済は、雇用・所得環境の改善と堅調な個人消費及び設備投資の拡大に加え、税制改革やインフラ投資等の新政権の経済・財政政策への期待による株高等もあり、回復基調が継続しました	1
以上の結果、水産食品事業の売上高は686億83百万円（前年同期比27億32百万円 4.1%増）となり、営業利益は３億16百万円（前年同期比１億63百万円 107.2%増）となりました	1
また、射出成形機用部品は、携帯端末の需要減少の影響を受けました	0
その他事業は、極低温冷凍機他が堅調に推移したことから、受注、売上ともに増加いたしました	1
粉粒体食品部門は、粉末スープ及び顆粒製品の受託が伸び悩み、売上高は4,675百万円と前年同期と比べ131百万円（2.7％）の減収となり、セグメント利益（営業利益）は74百万円と前年同期と比べ100百万円（57.6％）の減益となりました	0
これらの結果、飲料および食品製造販売事業部門（米州地域）の連結売上高は45,252百万円（前期比14.2％減）となりました	0
当連結会計年度における連結損益は、完成工事高158億4千万円(前年同期比33億1千万円減・17.3％減)、営業利益5億4千万円(前年同期比13億7千万円減・71.6％減)、経常利益7億6千万円(前年同期比13億6千万円減・64.2％減)、親会社株主に帰属する当期純利益は、5億8千万円(前年同期比11億3千万円減・66.2％減)となりました	0
一方、米国においては引き続き好調なＳＵＶ販売が市場を牽引し、また、中国においても減税効果等により自動車販売を押し上げ、全体として好調に推移いたしました	1
オンコロジー領域で、「レンビマ/Kisplyx」が33億20百万円(同196.6％増)と大幅に拡大する一方、「ハラヴェン」は109億48百万円(同16.9％減)となりました	0
その結果、売上高は10,456百万円（前年同期比7.4％増）となりました	1
収益面では、電力などのエネルギーコストの低減等はあったものの、製品販売価格安が大きく影響し、経常利益は500百万円（前年同期比53.0％減）、親会社株主に帰属する当期純利益は302百万円（前年同期比54.3％減）となり、前年同期を下回る業績となった	0
この結果、当連結会計年度における営業収益は、前連結会計年度と比較して1.7％、180百万円減少し、10,261百万円となりましたが、営業利益は、減価償却費の減少等により、前連結会計年度23百万円の営業損失に対し、60百万円の営業利益となりました	1
ヘルスケアセグメントの売上高は、前連結会計年度に比べ269億円減の1,342億円、売上高全体に占める割合は11％となりました	0
国内においては、自動車関連機器向けの売上が堅調に推移しましたが、家庭用蓄電システムなどの回路製品が減少したことににより、売上高は44,135百万円と前期比7.0％の減収となりました	0
「その他の営業収入」は、連結子会社における手数料収入や不動産賃貸収入を中心に、７億43百万円（前期比39.2％）となりました	0
受注高、売上高は発電設備工事が好調に推移したことから前期を上回りました	1
利益については、建設事業の利益率向上と開発事業等の好調な推移により売上総利益が増加したことを主因に、営業利益は前連結会計年度比39.9％増の1,553億円（前連結会計年度は1,110億円）となり、経常利益は同44.2％増の1,634億円（前連結会計年度は1,133億円）となった	1
その結果、材料販売事業は、売上高28億1千万円(前年同期比15億5千万円減・35.5％減)、営業損失1千万円(前年同期は7千万円の営業利益)となりました	0
天候不順の影響によりフィリピン産パイナップル缶詰の供給が不足し、主要市場である香港、中国をはじめとする全市場に影響し、前期の売上を下回りました	0
これらの結果、当連結会計年度の業績は、売上高60,903百万円（前期比2.0％増）、営業利益3,910百万円（前期比24.9％増）、経常利益4,578百万円（前期比9.5％増）、親会社株主に帰属する当期純利益は3,424百万円（前期比1.6％増）となり、売上高は７期連続の増収、営業利益は９期連続の増益、経常利益は４期連続の過去最高益の更新となりました	1
国内貨物におきましては、輸出入関連作業が増加したほか、セメント関連製品及び建材輸送関連貨物の輸送量が堅調に推移したものの、一部倉庫の稼働率が低迷しました	1
アルコール測定器の販売は好調に推移いたしました	1
住宅以外の分野では商業施設、公共施設、ホテル等の新設、リニューアル等の需要は好調に推移しましたが、慢性的な人手不足により着工ペースは鈍く、売上は微増となりました	1
一方、為替相場の円高傾向の影響、上半期での中華・韓国圏での当社コネクタの搭載車の需要減及び熊本地震による当社顧客の生産減等により、売上高は前期比1.7％減の375億４千７百万円となりました	0
住宅着工戸数は、米国・国内ともに増加しました	1
一般包材は、国内では、上期に災害の影響による自動車・光学製品向け梱包材需要の減少の影響を受け、売上は減少しました	0
その他の事業である不動産事業につきましては、外部顧客への賃貸契約が減少した結果、売上高は410百万円（前連結会計年度比47百万円減、10.3％減）、セグメント利益（営業利益）は125百万円（前連結会計年度比11百万円減、8.6％減）となりました	0
売上収益の内訳は、医療用医薬品が2,439億99百万円(同4.3％増)、ジェネリック医薬品が280億27百万円(同1.6％減)、一般用医薬品等が190億42百万円(同5.3％増)です	1
当連結会計年度よりアニメーション制作の株式会社オー・エル・エム及びその子会社２社が新たに当事業セグメントに加わったことにより、売上・利益とも大きく増加しました	1
個人保険、個人年金保険を合計した保有契約高は、45兆3,341億円（前年度末比5.1％増）となりました	1
また、鉄塔・鉄構他については鉄塔の新設・改造工事やボルトの取替工事などが減少したことにより売上高が減少しております	0
これらの結果、海外人材募集領域における売上高は1,202億円（前連結会計年度比42.5％増）となりました	1
一方、中国を始めとするアジア新興国や資源国等の景気下振れにより、日本の景気が下押しされるリスクがあるほか、英国のＥＵ離脱問題や米国のトランプ政権誕生などによる海外経済の先行きは依然として不透明な状況となりました	0
不動産業においては、外国人観光客数は、前年度と比較すると減少しておりますが、依然高水準で推移しており、都市圏を中心にホテル業はその恩恵を受けております	1
建設業界におきましては、再開発事業や経済対策に伴う公共事業の増加を背景に、市況は堅調に推移いたしました	1
しかしながら百貨店チャネルにおきましては、対象顧客の消費マインド低下を反映して価格に対する意識が厳しくなっており、苦戦を強いられました	0
親会社の所有者に帰属する当期利益は、393億58百万円(前期比28.4％減)となりました	0
流通業におきましては、マダムジョイ店舗では直営部門は利用客、売上ともに増加したものの、軽油単価の下落による商事部門の売上高減少やテナント売上高減少の影響により、減収となりました	0
また、円高の影響もありＬＰガス輸入価格が低位に推移したため販売価格が下落し、減収要因となりました	0
一方、円高の影響により、利益は減少いたしました	0
ゴム用射出成型機につきましては、引き続き主力製品の販売が堅調でした	1
広告宣伝用ディスプレイ材、折箱に用いられる発泡ポリスチレンボード「ミラボード」は、需要の縮小により売上は減少しました	0
当連結会計年度における不動産セグメントの売上高は、415,387千円（前期比4.9％増）となりました	1
このような状況の中、当社グループは顧客満足度の向上を経営方針として掲げ、新たな価値の創出にチャレンジすることを柱とした中期経営計画を遂行してまいりましたが、当期における受注高は、船舶用機器や水処理装置の受注が振るわず、95億42百万円（前期比4.2％減）にとどまりました	0
航空機関連材料およびエネルギー関連材料は、需要の端境期となりました	0
液体輸送用では、1,000ℓポリエチレンバッグ「エスキューブ」は微減、液体輸送用コンテナーライナー「エスタンク」は顧客の需要減にともない減少しました	0
売上高は、石炭販売分野における石炭価格の下落及び販売数量の減少などにより356億19百万円と前年同期比77億76百万円（17.9%）の減収となり、セグメント利益は、石炭生産分野における石炭価格の下落などにより10億23百万円と前年同期比３億55百万円（25.8%）の減益となりました	0
親会社株主に帰属する当期純利益は、旧本社の土地売却による特別利益を計上しておりますが、19億８百万円と前年同期比30.3％の減益となりました	0
そのため既存の4,000-5,000台積の中型船の需要が減り、ピーク時には待機船が20隻にのぼるなど、余剰感が出ています	0
ＬＰガス業界においては、世帯人員の減少や省エネ機器の普及により、家庭用の需要は減少傾向が続いた	0
このような状況の中で、当連結会計年度の収支については、売上高（営業収益）は、前連結会計年度に比べ22億67百万円減（1.2％減）の1,799億97百万円となった	0
また、情報通信以外にも、ウォーターサーバーや保険などの生活に関連するサービスも拡大しており、当社グループの強みである販売力を活かしながら、収益力の向上を図ってまいりました	1
当セグメントの売上収益は、前年同期比16.3％減の241,392百万円となり、調整後営業利益は前年同期比309百万円減の14,715百万円となりました	0
クリティカルケア事業では、現地通貨ベースで、営業活動強化に伴う販管費が増加しましたが、着用型自動除細動器「LifeVest™」の業績が引き続き順調に拡大し、その他の除細動器の販売も堅調に推移しました	1
