印刷業界におきましては、出版印刷市場は、電子出版関係が大幅に増加し、書籍は横ばいで推移しましたが、雑誌の大幅減少に歯止めがかからず、また商業印刷市場は、広告宣伝費はインターネット広告がけん引してプラス成長となりましたが、競争はますます激化するなど、依然として厳しい経営環境が継続しました	0
当事業部門におけるペットフード・用品関係につきましては、自社ブランド商品の開発強化とホームセンターなどへの販路拡大に努めましたが、販売チャネルの多様化による販売競争の激化などにより厳しい状況となりました	0
売上高は、既設海水淡水化プラントのリハビリ工事の売上が前期と比べて少なかったことから、26億82百万円（同57.6％減）となり、営業損益は売上が大幅に減少したことに加え、サウジアラビア向け海水淡水化プラント工事の長期中断に伴って採算性が悪化したことから受注損失引当金の追加計上を行い、５億３百万円の損失（前期は１億40百万円の利益）、受注残高は98億54百万円（前期比2.6％減）となりました	0
当連結会計年度の世界経済は、米国では新政権の経済政策による先行き不透明感がある中、堅調な個人消費に支えられ、景気は緩やかに拡大しました	1
営業損益につきましては、営業利益4億45百万円となり、前期に比べ3億15百万円、243.2%の増加となりました	1
営業利益は37.3％減の27億１千３百万円となりました	0
自動車業界は、軽自動車の販売が低迷するとともに、トラックの輸出が減少したものの、普通乗用車の国内外における販売が堅調に推移したため、国内生産台数は前期並みとなりました	0
ナフサクラッカーの稼働率は、前連結会計年度を上回りました	1
また、液体容器では不採算部門の解消を進めたことなどにより大きく減収となりました	0
このような環境の下、情報電子事業は前年比で売上微減の展開となったものの、建築資材事業で堅調な販売により増収を確保したことに加え、ライフサイエンス事業ではインドネシア子会社が加わったことで増収となり、当社グループの売上は前年同期比で増加いたしました	1
製粉、化学薬品等の用途は数量を伸ばしました	1
これらの結果、売上台数の合計は、15.9万台と前連結会計年度に比べ1.4万台（9.4％）の増加となりました	1
また、セグメント利益につきましては、４億１千５百万円（同3.2％減）となりました	0
保有契約年換算保険料は8,208億円（前年度末比5.1％増）、うち、医療保障・生前給付保障等は1,874億円（同4.3％増）となりました	1
かかる情勢の下での当社グループ（当社、連結子会社及び持分法適用会社）の経営成績は、用地代・建築コストが依然として高止まりの状況にあることから引き続きマンション建設事業を抑制したことによる売上高の減少、及び前年同期に伸長をした東北の復興需要による型枠製造に係る売上高の反動減の結果、売上高は、8,744百万円と前年同期に比べ1,489百万円（14.6％）減少、営業利益は、594百万円と前年同期に比べ463百万円（43.8％）減少し、経常利益は、574百万円と前年同期に比べて440百万円（43.4％）減少しました	0
セグメント利益は、前期比8.3％増の24億28百万円となった	1
葬儀一件単価は会葬者数減少等の影響により前連結会計年度に比べ減少しましたが、売上高は8,740百万円（前期比8.5％増加）、経費面では新規店舗出店による費用が増加したものの、営業利益は2,623百万円（前期比12.3％増加）となりました	0
エネルギーソリューション事業は、電気自動車用急速充電器の補助金事業の規模が大幅に縮小したこと等により、売上高8,093百万円（前年同期比11.8％減）、セグメント損失510百万円（前年同期はセグメント損失305百万円）となりました	0
同じく発売40周年を迎えた「日清焼そばＵ.Ｆ.Ｏ.」群も話題となって販売増加に寄与し、全体での売上も好調に推移しました	1
九州、四国にて、ハマチ、ブリ、マグロの養殖を展開する養殖事業は、販売単価の低下、販売数量の減少により売上高8,105百万円（前年同期比95.9％）、餌料価格の高騰等による生産コストの上昇などによりセグメント利益203百万円（前年同期比86.2％）となりました	0
当連結会計年度におけるわが国経済は、政府の景気対策の継続などにより緩やかな回復基調が続いているものの、個人消費や民間設備投資は力強さを欠き、また新興国経済の減速や米国新政権の政策動向などの影響により景気の先行きは依然として不透明な状況が続いています	0
また、アウトレット業態において、季節商材等滞留在庫品削減の強化施策を実施したため、値引き販売が増加し売上総利益率が低下いたしました	0
このような市場動向のもと、当連結会計年度の当社グループ業績は、高校・大学市場向けが前年同期比で増加しました	1
経常利益は、金利が低水準で推移した影響に加え、住宅ローンの融資実行増加にともなう初期費用の増加や、顧客の外貨・投資信託取引の減少もあり、50億円（同15.6％減）となりました	0
損益につきましては、営業利益は４億12百万円（前期比9.8％増）、経常利益は４億21百万円（前期比11.8％増）、親会社株主に帰属する当期純利益は２億76百万円（前期比16.7％増）となりました	1
電気・電子部品向けは、電池用途で民生用・車載用ともに販売数量が増加しましたが、為替の影響などにより、売上高は前期並みとなりました	1
日清食品チルド㈱の販売状況は、主力ブランド「行列のできる店のラーメン」を中心としたラーメン群が大きく伸長し、また、食べごたえのある太麺が特徴の「日清の太麺焼そば」、夏の定番商品である冷し中華群の好調もあり、前期比で増収となりました	1
光通信関連の光学デバイスはサーバー需要が底堅く、ハイエンド製品を中心に販売が好調でしたが、主力のLED用拡散レンズは、積極的な提案活動により顧客基盤の強化・拡大を進めたものの、主要顧客の生産調整の影響を強く受け、売上は低調に推移しました	1
この結果、当連結会計年度の売上高は 35,671百万円 (前年同期比 1.8％減)、営業利益は 1,451百万円 (前年同期比 27.1％減)、経常利益は 1,503百万円 (前年同期比 30.2％減)、親会社株主に帰属する当期純利益は 890百万円 (前年同期比 35.4％減) となりました	0
これらの環境のもと、上記の取組みにより過去最高の業績を達成することができました	1
営業利益は投資有価証券売却により法人事業税の付加価値割が２億２百万円追加で発生し、販売費及び一般管理費が増加したため、２億８千３百万円（前期比19.5％減）となりました	0
また、前連結会計年度より継続して取り組んでおります営業力の強化に加えて、コンタクトセンターの設置により、お客様からのお問い合わせに迅速に対応できる環境となったため有料老人ホームをはじめとした居住系施設の入居率も向上いたしました	1
こうした環境の中、当社グループでは、好調な市場を捉え、既存分野への深掘りによる拡販を推進するとともに、既存技術応用分野や新規市場の開拓に注力しました	1
親会社株主に帰属する当期純利益については、固定資産の譲渡に伴う特別利益を計上したことにより、71億９千１百万円（前期比 322.9％増）となりました	1
受注高は前連結会計年度を56.2％上回る306億2千6百万円、売上高は前連結会計年度を2.5％下回る182億7千1百万円、セグメント利益（経常利益）は6億7千1百万円（前連結会計年度はセグメント損失3億1千5百万円）となりました	1
利益面では、売上高の増加に伴い、営業利益は前期比５億５百万円増の45億93百万円（同12.4％増）、経常利益は前期比４億81百万円増の43億69百万円（同12.4％増）となりました	1
南米では、ブラジル経済低迷による自動車販売台数の落ち込みに加え、円高による外貨円換算額減少の影響もあり売上は減少しました	0
日本医師会・日本薬剤師会・日本大学との共同研究である「感染症流行探知サービス」におきましては、利用薬局は全国で１万件超となっております	1
当連結会計年度におけるセグメントの業績は、情報処理事業では売上高は38億62百万円（前年同期比0.7％減）、営業利益は２億42百万円（前年同期比47.9％増）、不動産事業では売上高は１億26百万円（前年同期比41.7％増）、営業利益は32百万円（前年同期比154.8％増）、レンタカー事業では売上高は１億４百万円（前年同期比790.9％増）、営業損失は61百万円（前年同期は営業損失28百万円）、人材関連事業では売上高は５億67百万円（前年同期比871.3％増）、営業損失は25百万円（前年同期は営業損失０百万円）となりました	1
また、将来の持続的な発展を見据え、自社開発の住宅建設業者向けパッケージソフトウェアの全面改良といった投資を行ったことで、募集費、教育費に加え研究開発費が増加しましたが、稼働率の向上や受注単価改善などに努めた結果、経費増加分を吸収し増益となっております	0
ゴルフパック利用が減少したものの、地元圏の集客は堅調に推移し、利用人員は58千人（前期比０千人、1.1％減）となりました	0
スニーカーなどスポーツトレンドは落ち着きが見られるものの需要は依然として高く、婦人靴市場やレザーカジュアルが相対的に苦戦するなど、厳しい経営環境が続いております	0
当連結会計年度における経営成績は、売上高３兆639億円（前期比1.2％増）、営業利益396億50百万円（前期比6.2％減）、経常利益533億60百万円（前期比3.2％減）、親会社株主に帰属する当期純利益290億11百万円（前期比5.7％減）となりました	0
その結果、売上高は132億７千２百万円（前年度比19.8％減）となりました	0
一方で、南米は経済低迷の長期化により、不振が続きました	0
一方、レアアースは、相場低迷及び取扱量の減少により低調に推移しました	0
また、葬儀業の平成28年売上高は599,610百万円と前期に比べ減少し、件数は420,585件と増加しております	0
このような経済環境のもとで当社グループは、営業活動の積極的な展開と経営効率の向上に努めた結果、中期計画初年度の売上高は299億37百万円となり、前年同期と比べ５億85百万円(△1.9％)の減収となり、中期計画と比べ20億63百万円(△6.4％)計画を下回りました	0
米麦の減少は2.8%の減少にとどめましたが、主力の合成樹脂用途が1.9%減少しました	0
熊本地震などにより上期の受注は遅れましたが、受注高は63億３千７百万円（前期比0.8％増）、完成工事高は59億９千７百万円（前期比4.4％減）となりました	0
海外では、積極的なプロモーション活動により、米国や台湾においてジェルネイル製品の認知度が高まったことから、売上は好調に推移いたしました	1
産業資材関連事業は、太陽電池用部材が海外向け・国内向けともに前年を下回った	0
また市販出版物においては、『首都圏発　日帰り大人の小さな旅』等一部のヒット商品や『まっぷるマガジンmini版』出版による効果はあったものの、前連結会計年度にあったような新規シリーズやガイドシリーズの全面改訂等もなく、書店店頭での実売状況も好転しない中、売上高は大きく減少することとなりました	0
国内人材募集領域においては、有効求人倍率が高位安定し求人広告掲載件数の増加も続く等、堅調な雇用環境が継続しております	1
しかしながら、シリコーンハイドロゲル素材の新商品投入や乱視用、遠近両用のラインアップ強化等、メーカー間の競合環境は激化しております	1
以上の結果、当期の業績は売上高1,342億４百万円（前期比5.0％増）、営業利益313億41百万円（同3.3％増）、経常利益317億26百万円（同3.4％増）、親会社株主に帰属する当期純利益242億３百万円（同4.8％増）となり、各利益とも過去最高を更新しました	1
雇用・所得ともに堅調なことから、個人消費も底堅く推移いたしました	1
建設工事業の子会社のうちＪＫホーム株式会社は、過年度の戸建分譲プロジェクト案件が完売になったほか、新築、リフォームともに新規受注が大きく好転し、売上高が期を上回りました	1
この結果、当連結会計年度における当該事業分野の業績は、売上高は215億60百万円（前年同期比75.0％増）、営業利益は10億８百万円（前年同期比115.6％増）となりました	1
旅行分野においては、第２四半期連結会計期間において子会社を譲渡したことにより、売上高は前連結会計年度比で減少となりました	0
民生機器事業は、ＯＡ・情報機器操作パネル、アミューズメント向け基板ユニット等が減少し、売上高11,472百万円（前年同期比18.0％減）、営業損失47百万円（前年同期は338百万円の営業損失）となりました	0
売上高は821億円（対前期＋2.2％）、営業利益は113億円（同＋10.4％）となりました	1
このような市場環境の下で、当社グループは、国内では、生活用品関連及び自動車関連向けを中心に受注は増加しました	1
当社グループにおける中国の業績は、平成28年11月に湖北省武漢市に中国３号店（直営店）がオープンして一部寄与したことに加え、平成27年２月に開業した中国２号店（直営店）が当連結会計年度を通して寄与したこと、FC案件の契約金の一部を売上計上したこと等の結果、元ベースで売上高が6.4％増加、営業利益が61.2％の増加となりました	1
当セグメントにおいては、産業プロセス空調設備工事、一般空調・衛生設備工事を行っており、受注高は223億円（前期比22.5％増）、売上高は206億円（前期比0.4％減）、営業利益は16億85百万円（前期比12.9％増）となりました	1
売上高は1,665百万円（前連結会計年度比28.8％減）、営業利益は629百万円（前連結会計年度比50.5％減）である	0
価格高騰による団体旅行の減少に加え、11月に発生した福島県沖地震の影響によるキャンセルの発生及びその後の	0
当セグメントにおきましては、主に主要取引先からのインフラ構築・運用サービス及びＥＲＰ関連製品のカスタマイズと設計・開発が順調に伸びており、売上高は順調に増加しましたが、業界全体の課題でもある人材確保の厳しい状況が続き、外注費が増加いたしました	1
平成28年度のわが国経済は、新興国経済の減速や英国のＥＵ離脱等を背景に、年度前半は、株価下落や円高進行によって景気回復へ向けた動きに足踏みが見られました	0
以上の結果、機械関連事業全体としては平成28年３月期第４四半期連結会計期間より株式会社富士テクニカ宮津を連結子会社化したことが影響し、前期に比べ増収となりましたが、自動車用プレス金型における外注費用の増加などにより、減益となりました	0
チルド食品部門は、焼そば、生ラーメンの受託は好調でしたが、ゆで麺製造ラインを１月に撤去したことにより、売上高は3,198百万円と前年同期と比べ52百万円（1.6％）の減収となり、セグメント利益（営業利益）は336百万円と前年同期と比べ34百万円（11.5％）の増益となりました	1
当連結会計年度の業績は、売上高は、店舗数の減少などにより、325億79百万円（前年同期比4.2％減）となりました	0
住宅市場におきましては、年度末にかけて鈍化の動きがみられましたが、日銀のマイナス金利導入に伴う住宅ローン金利の低下もあり、貸家を中心に概ね堅調に推移し、平成28年度の新設住宅着工戸数は974千戸（前年度比5.8％増）となりました	1
一方、金属製品はタービンロータ等の輸出取引が回復しました	1
セグメント営業利益は資源需要の低迷から利幅が圧縮されるなど、厳しい状況となり１億32百万円(前年同期は５百万円の損失)の損失となりました	0
以上の結果、全体の売上高は1,388億円と前連結会計年度に比べ140億円（9.2％）の減収となりました	0
営業損失は、販売管理費の削減などにより92百万円(前連結会計年度は193百万円の営業損失)となりました	1
経常利益の主な増減要因には、変額保険の新契約の獲得の減少および市場環境の改善による最低保証に係る責任準備金繰入額の減少や保有契約の積上げによる増益要因や、変額保険の最低保証に係る市場リスクヘッジを目的とするデリバティブ取引に係る損益の悪化や一般勘定における有価証券売却益の減少による減益要因がありました	0
塩酸は、販売数量の減少により、前期に比べ減収となりました	0
また、国内経済においても、足許では堅調な雇用・所得情勢を受けて個人消費が改善し企業収益も回復しておりますが、米国新政権の諸政策をはじめとした海外情勢の景気への影響の懸念もあり、先行き不透明な展開が続いております	1
また、国際業務部門の資金運用収支は、41億４百万円、役務取引等収支は84百万円、その他業務収支は47億80百万円となりました	1
欧州では、自動車部品の需要増等により販売数量は大幅に増加しましたが、製品価格の低下や円高による外貨円換算額減少の影響もあり売上は減少しました	1
利益面では、円高の影響や売上構成の変化により売上原価率が上昇したことに加え、業容拡大に向けた人員の増強や研究開発投資により販管費が増加したことから、営業利益は前期比17.4％減の135億８千５百万円、経常利益は前期比12.8％減の140億５千３百万円、親会社株主に帰属する当期純利益は前期比13.0%減の91億４千９百万円となりました	0
当連結会計年度におけるわが国経済は、政府や日銀による経済政策や金融政策を背景に緩やかな景気の回復基調が続き、企業収益の改善などにより、設備投資の新規・更新需要は堅調に推移しました	1
以上の結果、回転寿司事業の売上高は676億42百万円（前年同期比2.5％減）となりました	0
産業機械事業については、大口ユーザー向けの大規模定修工事が隔年受注であり、今年度は発生しないことなどにより、減収減益となった	0
海外経済の減速から国内外の販売が低迷し、売上高は前期比10.7％減の15,020百万円、セグメント利益は前期比2.3％減の2,768百万円となりました	0
カーナビゲーションシステムは、中国で増加しましたが、国内や北米で減少したことから減収となりました	0
建設業界においては、東京オリンピックに向けたインフラ整備や大規模都市開発の動きがより活発になり今後も繁忙が見込まれております	1
スマートデバイスビジネスでは、マリオの新しいアクションゲームアプリ『スーパーマリオ ラン』のiOS版を12月に、Android版を3月に配信開始し、世界中のお客様から大きな反響をいただいています	1
主力商品であるタイヤ・ホイールの販売は、降雪地域による履き替え需要の増加もあり、売上は前年を僅かに上回りました	1
以上の結果、売上高は67億31百万円（前期比7.4％増）、営業利益は5億41百万円（前期比86.2％増）と増収増益となりました	1
電子機器は、接合機器がスマートフォン等情報機器に使用される電子部品の小型化に対応する生産設備の需要の取り込み、アジア地域におけるスマートフォン向け設備の需要増により輸出も好調に推移したものの、前期の計測事業の譲渡による減収及び感染症対策等特定需要向け機器の減少等による影響で赤外線機器が減収となったことから、売上高は減少しました	0
新築マンション市場におきましては、地価や建築費の影響により、都市圏を中心に販売価格が高止まりの傾向にあるものの、住宅需要は低金利や住宅取得優遇策等に支えられ、堅調に推移しました	1
この結果、売上高は39億51百万円（前期比101.0％）となりました	1
このような状況下で、食品部門では、量販店・外食向けである精米販売の数量は、69千玄米トン（前期比3.9％増）と増加しましたが、一般小売店や他卸売業者向けである玄米販売は、主要産地である東北・関東を中心に取引価格の高騰から思うようなコメの手当ができず、23千玄米トン（同47.7％減）と大幅に減少しました	0
また、自己ディーリング部門は、48百万円の売買損（前連結会計年度は331百万円の売買益）となっております	0
また、当社の業績に影響のある国内向け設備投資につきましては、一部の企業や業種では主要製品の増産等を計画する新規設備投資の動きがありましたが、多くの企業では依然として設備投資意欲は高まらず、慎重な姿勢が維持され、既存設備の維持・更新が中心となりました	0
海外では、中国やその他のアジアにおけるＩＴ・電子機器関連向けの売上は減少しましたが、中国や北米の自動車関連向けが好調であったため、売上は増加しました	1
また、営業利益は前期比936.0％増の４億８千７百万円となりました	1
豆乳飲料は、健康志向の高まりを背景に、特定保健用食品の商品が伸長しました	1
ATM運営事業売上高は、前年同期比4.1％増の4,050百万円(前年同期3,889百万円)、売上原価は、前年同期比5.1％減の2,428百万円(前年同期 2,559百万円)、売上総利益は前年同期比22.0％増の1,622百万円(前年同期 1,330百万円)となりました	1
医薬品事業の売上高は、614億５千４百万円（前連結会計年度比0.6％減）となりました	0
また、郊外型の店舗が多い当セグメントにおいても北関東エリアと同様に酒類消費の減退が大きく影響しているものと考えられます	0
また、営業利益は、売上収益が減少した影響のほか、前連結会計年度に日立ツール株式会社（現 三菱日立ツール株式会社）の株式を譲渡したことに伴う事業再編等利益25,931百万円を計上したことから、前年同期比31,793百万円減少し、21,277百万円となりました	0
売上高は前連結会計年度比1%減少の1,184億62百万円となり、営業損益は前連結会計年度比17億49百万円減少の80億30百万円となりました	0
器具器材関連事業におきましては、溶接材料及び溶接切断器具の需要が増加したこと等により売上高は増加いたしました	1
当社グループの属する情報サービス業界においては、景気の先行き不透明感は続いているものの、企業のＩＴ投資は緩やかな増加傾向で推移しました	1
