③  「その他」では、経常収益はクレジットカード業務において売上高が増加したことなどから前年度と比べ35百万円増加して4,147百万円となりました	1
しかしながら収益的には輸出市況の低迷等の影響をカバーできず、増収ながらも若干の減益となりました	0
こうした中、当社グループ販売強化項目の一つである「特定市場」を中心に市場開拓を行うとともに中国をはじめとする代理店網の強化策などに積極的に取り組んでまいりましたが、外部顧客向売上高は現地通貨ベースで前年同期比2.2%減となりました	0
保険金等支払金は、3,724億円（同2.5％増）となりました	0
また、運営現場の効率化により、業務時間の大幅な短縮を図るなど運営コスト削減に努めた結果、収益を大きく改善することができました	1
売上収益は、抗がん剤「レンビマ」(欧州における腎細胞がんに係る製品名「Kisplyx」)および抗てんかん剤「フィコンパ」(英名「Fycompa」)が拡大するとともに、新たに連結子会社となったEAファーマ株式会社の貢献があった一方、日本における薬価改定や為替の影響により、全体では5,390億97百万円(前期比1.6％減)となりました	1
また、良好な調達環境により引き続き金融費用が減少いたしました	1
医療用プローブケーブルは、海外向けの需要が減少し、前年同期を下回りました	0
当連結会計年度の世界経済は、米国を中心に景気は概ね堅調に推移しましたが、英国のEU離脱問題による影響のほか、中国をはじめとする新興国経済の減速懸念や米国新政権の政策動向の不確実性など、景気の先行きは不透明な状況が続きました	1
このような厳しい経営環境の中で、中間期は減収減益を余儀なくされましたが、通期では中国向け環境用水質分析計をはじめとする海外輸出の大幅な増進に加えて、医療関連機器を含む計測機器事業全般が回復し増収となりました	1
しかしながら、新設住宅着工戸数の押し上げ要因が主に貸家であることから一棟当たりの石膏ボード使用量が伸び悩むという一面も窺われました	0
神根サイボー㈱のインテリア施工事業は、当社が賃貸する大型商業施設の店舗入替えに伴う内装工事等を受注し、増収増益となりました	1
このような状況の下、当社グループは、販売戦略の要である「テキスタイル・プロジェクト」において、在庫の適正化や素材企画力を活かした売れ筋商品の開発、グループ会社との合同展示会開催などによる販売強化に努めたものの、川下にあたるアパレル市況の低迷により、業績改善には至りませんでした	0
電子部品業界では、既存技術応用分野及び新規市場の開拓に注力しましたが、前期好調に推移したスマートフォン向け圧電部品の製造用装置の反動減により、受注・売上ともに前年同期に対して減少となりました	0
自販機分野は、国内市場の業界再編及び国内飲料メーカーの投資抑制に伴う需要減少、中国市場においては、顧客開拓は進むものの、設置計画の見直し等が影響し、売上高、営業損益ともに前連結会計年度を下回りました	0
新契約年換算保険料も、定期保険および米ドル建保険の販売が好調であったものの、変額保険および一時払終身保険の販売減少により、781億円（同8.1％減）となりました	0
床用塗料においては、連結子会社の阿童木（無錫）塗料有限公司の清算による売上減少と当社の主力となる改修市場での設備投資物件の減少により前年を下回りました	0
営業利益以下、各区分利益は、前年同期と比較して減少し、損失を計上いたしました	0
一方で、マスマーケットへ向けたオリジナルブランドの「ケンフォード」につきましては、品質や価格のバランスが評価され、取扱店舗数も順調に増加したことなどにより、好調に推移いたしました	1
このような状況の中、戸建住宅向け機能門柱や金属パネルなどの建築商材並びに防災倉庫や耐震・免震材などのレジリエンス製品の拡販に努めました結果、売上高490億２百万円（前連結会計年度比2.7％増）となりました	1
以上の結果、当連結会計年度の業績は、売上高592百万円（前年同期比19.6％増）、営業損失36百万円（前年同期営業損失12百万円）、経常損失26百万円（前年同期経常損失15百万円）、親会社株主に帰属する当期純損失30百万円（前年同期親会社株主に帰属する当期純損失28百万円）となりました	0
また、米国の需要は高水準で推移しました	1
当事業年度の我が国の経済は、為替が若干不安定な動きを見せる状況にありますが、企業収益は堅調に推移しており、雇用情勢及び所得環境も改善傾向にあります	1
当連結会計年度におけるわが国経済は、世界経済の緩やかな回復等を背景にした輸出や設備投資をけん引役に、底堅く推移しました	1
航空事業は、輸出で電子・電気機器関連品や自動車関連部品等の取扱いが順調に拡大し、前期比で取扱重量は21.1％増となりました	1
当連結会計年度のわが国経済は、雇用・所得環境の改善から個人消費は持ち直しの動向が見られるなど緩やかな回復基調が続きましたが、英国の欧州連合(ＥＵ)離脱決定や米国新政権の政策動向による影響など、海外経済は不確実な状況で推移いたしました	1
産業プラント分野は、国内の省エネ、更新需要が堅調に推移したこと、データセンター向け等の新規ソリューション事業の増加により、売上高、営業損益ともに前連結会計年度を上回りました	1
さらには、当社グループ販売強化項目の一つであるカタログディストリビューターを中心とする「ネットセールス」に取り組むなど、積極的に施策を展開してまいりましたが、現地通貨ベースでは前年同期比3.0%減となりました	0
化学設備プラントおよび一般産業用プラント建設は、請負工事の増加により、前期に比べ増収となりました	1
電子材料用金属粉や高純度酸化タンタルは、中華スマホの高機能化と需要拡大、電装化の進む自動車向けの需要が堅調であったことから販売量は増加しました	1
このような環境の下、営業力を強化したこと及び既存派遣契約の継続や新規派遣契約数の増加に注力したこと等により、引き続き事務、エンジニアリング及びIT分野を中心に売上高が好調に推移しました	1
産業機器事業において、北米向けレジャービークル用エンジンの販売が減少したことにより、売上高は353億円と前連結会計年度に比べ48億円（11.9％）の減収となりました	0
当連結会計年度におけるわが国経済は、企業収益や雇用環境の改善が持続し、昨年末以降の株価回復などを背景として個人消費に持ち直しの兆しがみられるなど、緩やかな回復基調が続きましたが、将来の不透明さによる生活防衛意識などもあり、回復テンポは鈍く一部に改善の遅れもみられました	1
国内のコンパウンド事業のうち塩ビコンパウンドは、電線市場、自動車市場で後半に受注の回復がみられたものの、建材市場では原材料価格の下落に伴う製品価格調整の影響もあり、減収となりました	1
当連結会計年度における当該セグメントの業績は、売上高26,646百万円（同7.9％増）、営業利益2,095百万円（同12.8％増）となりました	1
当社グループの関連業界については、主原料である鉄スクラップ価格が大きく変動するなかで製品販売価格の改善などに努めたが、建設業界の工事着工遅れなどから鋼材需要は伸び悩み、価格の改善が進まず、厳しい環境となった	0
この結果、個人預金が増加しましたので預金は当年度中18,013百万円増加して、当連結会計年度末残高は4,737,336百万円となりました	1
バス事業におきましては、貸切バスの稼働が伸びず営業収入は前年同期に比べ減少いたしました	0
水処理プラント事業は、長期包括運営管理事業の受注があったことや大規模補修改良工事が順調に推移したことから、受注、売上ともに増加いたしました	1
一方、営業費用は、修繕費が増加したものの、燃料費が減少したことから、前連結会計年度に比べ34億61百万円減（2.1％減）の1,652億27百万円となった	1
自動車用鋳物については、北米において、ピックアップトラック向けは高水準を維持しましたが、新興国経済の減速や穀物・原油価格が低調に推移した影響等を受け、農業機械・建設機械向けの需要が減少したため、全体としては前年同期と比較して減少しました	0
貸出金は、法人・個人ともにお客さまのお借入のニーズに積極的にお応えしてまいりましたことにより、期末残高は前年度末比4,997億円増加し、９兆2,688億円となりました	1
上記の結果、当事業年度の売上高は959百万円（前年同期比36.3％減）となりました	0
また、中古車においては、各種施策による中古車ディーラーとの取引拡大に努めてきた結果、取扱高が増加いたしました	1
当業界におきましては、人手不足を主因とする人件費関連コストの上昇並びに消費者の強い節約志向などにより、依然として厳しい経営環境が続いております	0
それに伴い人造黒鉛電極の需要は減少し、特に輸出においては価格競争がさらに激化し、採算の合わない販売を抑制したため、販売数量が減少しました	0
加えて、季節に合わせた商品企画として、抹茶フェア、パインフェア、夏塩フェア、いも・栗フェア、ホワイトフェア、いちごフェアを実施したことにより、ファミリーサイズ商品群やマイベネフィット商品群などが好調に推移しました	1
経常利益は18億88百万円（前年同期比３億19百万円、14.5%減）となりました	0
その結果、当連結会計年度の売上高は1兆4,101億円（前期比3.1％減）、営業利益は314億円（前期比30.9％減）、経常利益は367億円（前期比30.2％減）、親会社株主に帰属する当期純利益は252億円（前期比24.9％減）となった	0
受注高、売上高はカンボジア、ミャンマーが好調に推移したことから前期を上回りました	1
タンタルコンデンサ事業につきましては、車載用レーダー装置等のカーエレクトロニクス向け及び家庭用火災報知器向けの需要は増加しましたが、スマートフォン向けの需要が減少しました	1
ロジスティクス事業では、経済の成長鈍化による影響が新興国の一部地域でみられましたが、カンボジア等、今後大きく成長が見込まれる地域への投資を継続し事業を拡大しました	0
また、営業利益は１億９千６百万円（前年同期比6.1％減）となりました	0
一方、海外においては、中国ならびにアジア新興国経済の減速のほか、米国新政権の政策や英国のＥＵ離脱が経済に与える影響も懸念されるなど、先行き不透明な状況のまま推移いたしました	0
アジア地域においては、家電機器向け需要が低調となったことなどにより、売上高は41,776百万円と前期比10.2％の減収となりました	0
これらの結果、売上高は11,294百万円（前期比6.0％増）となりました	1
また、機能性パンプス「プラチナムシリーズ」を昨年春に発売し、チャネルを問わずその履き心地のよさが評価されております	1
当連結会計年度におけるわが国経済は、欧米先進国での景況感の改善傾向や中国・アジア新興国での景気の持ち直しなどがあった一方、米国新政権が主導する経済政策の実現可能性への懸念もあり、先行き不透明な状況で推移しました	1
一方、社会インフラ領域でのソフトウェア開発や、自動車関連での組込み系システム開発の需要、メーカーをはじめ広い領域での業務用アプリケーションの開発需要は増加傾向にあります	1
この結果、当連結会計年度における営業収益は、前連結会計年度と比較して0.5％、99百万円増加して21,871百万円となりましたが、営業損益は、人件費の増加や新車導入に伴う償却費の増加等の影響により、前連結会計年度771百万円の営業損失に対し、1,102百万円の営業損失となりました	0
これらの状況により、売上高は4,890億円(前年同期比3.0％減)となり、このうち海外売上高は3,590億円(前年同期比2.7％減、海外売上高比率73.4％)となりました	0
基盤素材セグメントの売上高は、前連結会計年度に比べ652億円減の5,656億円、売上高全体に占める割合は47％となりました	0
厳しい競合環境が続く米州市場での競争力を更に強化するため、生産性の向上を目的として新型一括溶接設備を、CR-Vのモデルチェンジに合わせ、各拠点に導入しました	0
恒常化する石油需要の減退とそれに伴う業界再編、さらには電力・ガス小売りの全面自由化による経営環境の変化を踏まえ、関連する事業分野を大きく集約することにより、戦略構築と事業展開の一体化・迅速化を推進しました	0
この結果、当連結会計年度の売上高は、83億円（前期比0.6％増）、経常利益は９億88百万円（前期比12.0％減）となりました	1
この結果、当連結会計年度の売上高につきましては、国内事業の調合香料事業と合成香料・ケミカル事業がいずれも前期比減収の中、中国市場を主力とする海外事業が前期比増収となりましたが、売上高は前連結会計年度比5.3%減の15,250百万円となりました	0
売上高は、前連結会計年度と概ね同水準で推移し、前連結会計年度比9.0％増の4,009億円（前連結会計年度は3,679億円）となった	1
また、中国国内取引は建機、農機及び空調機等の主要対面業界に回復の兆しが見られ堅調に推移しました	1
不動産業におきましては、不動産賃貸業では、解体に着手した広電第二タワービルのテナント退去による賃料収入の減少により減収となり、不動産販売業では、前連結会計年度に「西風新都グリーンフォートそらの」の商業用地および業務用地や五日市分譲マンションの販売があったのに対し、当連結会計年度ではそのような大型物件の販売がなかったことから、減収となりました	0
その結果、一般勘定と特別勘定を合計した資産運用損益は、2,091億円（同42.2％増）の利益となりました	1
臨床診断薬や衛生検査薬、運送事業が前期の売上を上回りました	1
当期利益（親会社の所有者に帰属）については、持分法による投資損益の良化等により、前連結会計年度を39億円（40.2％）上回る136億円となりました	1
衣料部門については、前期に実施した「繊維・アパレル事業の構造改革」に伴う売上高の減少や、暖冬の影響から秋冬物の売上が伸び悩んだことから、売上高は前期を下回った	0
当社グループの主たる事業である投資・金融サービス業においては、６月の英国によるＥＵ離脱の是非を問う国民投票や11月の米大統領選挙といった欧米のイベント時には、貴金属市場を中心に市場は活況となりましたが、ＦＲＢによる利上げ判断の動向や米国の新政権による経済政策の先行きを睨んだ様子見ムードにより、期間全体を通して積極的な取引を手控える期間が長引きました	1
海外における各種プロジェクト案件が減少したこと等により、売上高は469億円と前連結会計年度に比べ44億円、8.6％の減収となりましたが、営業利益は38億円と前連結会計年度に比べ１億円、5.3％の増益となりました	0
営業利益は、増収効果などにより前年同期比15.6％増の35億11百万円となりました	1
非製造業においては、新車販売に持ち直しの動きが見られ、住宅関連も緩やかに回復いたしました	1
国内、中国、EMEAの中小型の減・変速機の市況は堅調に推移したものの、国内外の大型機種の市況低迷が継続したことから、受注、売上ともに減少いたしました	0
当社の主要顧客である造船業界においては、中国経済の減速等による海運市況の長期低迷に伴う船腹過剰、また一昨年の窒素酸化物３次規制の適用前の駆け込み発注に対する反動もあり、受注量は大幅に減少しており厳しい状況が続きました	0
このような環境の中、売上高につきましては、米国でのモデルチェンジに伴う売上構成変化及び為替換算影響等により、39,752百万円（前期比2.2％減）となりました	0
以上の結果、当部門の売上高は108億20百万円と前連結会計年度に比べ２億88百万円(2.7%)の増加、営業利益は２億12百万円と前連結会計年度に比べ33百万円(19.0%)の増加となりました	1
また、爆買いブームが沈静化する中、インバウンド集客を団体から個人へ切り替え好調を維持	0
当連結会計年度の当セグメントの業績は、売上高275億１百万円(前年同期比3.5％減)、セグメント利益(営業利益)48億39百万円(同17.7％減)であった	0
営業利益は、海外事業の外貨円換算額の減少による影響はありましたが、原材料安が継続したことや付加価値の高い製品の販売が好調であったこともあり増加しました	1
主要なセグメントの売上高につきましては、国内事業のうち、フレグランスとフレーバーの調合香料事業は、フレグランスは前期比増収となりましたが、フレーバーの取扱商品が前期に比べ大幅減収となったため、前期比9.1％減の7,074百万円となりました	0
以上の結果、当期の旅行事業における売上高は1,606億円（前期比4.0％減）、営業利益は37億円（前期比12.8％減）となった	0
一方、中国をはじめとするアジア新興国の景気減退、米国新政権における今後の政策動向、欧州における政情懸念等、世界情勢においては依然として先行き不透明な状況となっております	0
この結果、当連結会計年度の売上高は112,854,233千円（前期比2.5％減）、営業利益は2,752,018千円（前期比2.3％減）、経常利益は2,658,071千円（前期比10.9％減）、親会社株主に帰属する当期純利益は1,576,653千円（前期比20.2％減）となりました	0
しかし、欧州でのBREXITをめぐる先行き不透明感の高まり、各国における保護主義の台頭や急激な為替変動のリスク、また、国内における人手不足の顕在化など、依然として予断を許さない状況が続いています	0
受注高は産業プロセス空調設備工事、一般空調・衛生設備工事ともに好調に推移したことから前期を上回りました	1
一方、インドネシアでは、民間消費が堅調な伸びを維持し、景気は徐々に回復に向かっており、新たな事業機会の広がりが期待されるなど、今後も人口増加や中間所得層の拡大により衣料分野や生活関連分野などで需要増加が見込まれます	1
高齢者向けマンション事業におきましては、売上高は堅調に推移いたしました	1
石油業界においては、低燃費車の普及など省エネルギー化の進展により、燃料油の需要は減少傾向が続いた	0
その結果、部門全体の売上高は8,012億円（前期比2.5％減）、営業利益は188億円（前期比35.7％減）となった	0
その他の売上高は、ＦＡ機器の増加はありましたが、ホームＡＶや光ディスクドライブ関連製品の減少に加え、円高の影響もあり、前連結会計年度に比べ19.2％減収の74,193百万円となりました	0
以上の結果、ゴルフ運営事業部門における売上高は9,164百万円（前期比1.0％減）、営業利益は591百万円（前期比33.0％減）となりました	0
その結果、売上高は1百万円（前連結会計年度比7.7％減）、営業損失は16百万円（前連結会計年度は74百万円の営業損失）となりました	0
一方、営業利益は３億14百万円（同0.2％減）とほぼ横ばいで推移しました	0
当連結会計年度におけるわが国経済は、政府の経済政策を背景に企業収益や雇用情勢の改善が見られるなど、緩やかな回復基調が続きました	1
ロボドリル（小型切削加工機）につきましては、自動車、二輪車の部品加工向けの販売が堅調に推移し、また、第４四半期からＩＴ関係の一時的需要が動き始めました	1
商業印刷部門では、カタログ・パンフレットが減少したものの、リーフレット・チラシ、ＰＯＰ、ノベルティなどが増加した結果、当部門の売上高は176億９千７百万円(前期比1.9％増)となりました	1
また売上は、運搬機械事業をはじめ各事業の工事が順調に推移したことから、増加いたしました	1
当連結会計年度におけるわが国経済は、雇用状況の改善が続き、緩やかな景気回復が続きました	1
また、コスト削減努力あるいは採算管理の徹底等により、粗利益率に顕著な改善が見られました	1
エレクトロニクス事業のセパレータ事業では、各製品の販売数量が増加し、前連結会計年度第２四半期より連結したPolypore社の業績を通期で取り込みましたが、買収に伴うのれん償却費等を計上し、円高の影響も受けました	1
これに、特別損益として、シンジケートローン実行に係る借入金の中途解約損失や中国の縫製事業からの完全撤退に伴う特別損失、中国における商業施設事業の持分譲渡に伴う特別利益などを計上し、さらに繰延税金資産の計上などを加味して法人税等の負担を考慮した結果、親会社株主に帰属する当期純利益は１億56百万円(前期比25.0％増)となった	1
当期のわが国経済は、輸出の回復などを背景に企業収益は増加し、緩やかな景気の回復を見せました	1
プロテクトフィルムについては、台湾子会社で量産体制を整え、国内分も含め生産数量としては前年を上回ったものの、業界における販売単価下げの影響を大きく受けたことで売上が伸び悩み、事業全体としては売上微減の展開となりました	0
鉱山機械需要についても回復の兆しが見られました	1
利益については、為替による粗利益の減少、研究開発費・人件費などの販売管理費の増加があったものの、売上高の増加および製品構成の良化等により、営業利益は微増となりました	1
セグメント利益は、防蟻・防水・断熱工事等の住宅関連事業において収益性が向上し、セグメント利益の向上に貢献はしたものの、上記売上高の減少を補うまでには至らず、645百万円と前年同期に比べ56百万円減少しました	0
ブラジルにおいては、消費者の健康意識向上による低カロリー製品ニーズの高まりに応えるため、昨年７月から乳製品乳酸菌飲料「ヤクルト40ライト」の販売を開始しました	1
当事業年度の資金運用収支は179億17百万円、役務取引等収支は△15億80百万円、その他業務収支は47億85百万円となりました	1
